id,review,text,author,pub_date
1,6,"Ничего подобного, в фильме всё не так, и программирование тут вообще ни при чём!",102,
2,6,"Ну надо же, не нашлось ничего лучшего, кроме как прокомментировать разговор про гамбургеры, будто в фильме ничего важнее этого нет",101,
3,6,"Кстати, а что такое ""четверть фунта""? В граммах это сколько?",103,
4,50,"Вот это да, никогда не слышал об этом! Спасибо за информацию",100,
5,50,"Почему обязательно  нужно любой разговор сводить к навозу? Хорошая детская сказка, ва вы тут пишете про какие-то субстанции неприятные. Фу таким быть.",103,